{"schema_version": "0.2", "action": "cleanup", "provider": "aws", "environment_id": "railshot-airgap-test", "status": "cleaned", "cluster_status": "absent", "cilium_status": "absent", "workload_status": "absent", "endpoint": null, "endpoint_scope": null, "error": null, "states": [{"state": "NODE_READY", "timestamp": "2026-10-02T05:45:33.516532+00:00"}], "deployment_mode": null, "bundle_version": null, "bundle_verified": false, "network_capabilities": {}, "network_details": {}, "network_states": [], "fallback_used": false, "fallback_reason": null, "preload": {}, "exposure_status": {}, "update_available": null}
