{"schema_version": "0.2", "action": "deploy", "provider": "aws", "environment_id": "railshot-airgap-test", "status": "ready", "cluster_status": "ready", "cilium_status": "healthy", "workload_status": "ready", "endpoint": "http://192.168.5.15:30080", "endpoint_scope": "node-local", "error": null, "states": [{"state": "NODE_READY", "timestamp": "2026-10-02T05:42:59.021584+00:00"}, {"state": "K3S_INSTALLING", "timestamp": "2026-10-02T05:42:59.829042+00:00"}, {"state": "K3S_READY", "timestamp": "2026-10-02T05:43:01.589916+00:00"}, {"state": "CILIUM_INSTALLING", "timestamp": "2026-10-02T05:43:01.928159+00:00"}, {"state": "CILIUM_READY", "timestamp": "2026-10-02T05:43:16.960236+00:00"}, {"state": "WORKLOAD_DEPLOYING", "timestamp": "2026-10-02T05:43:17.239411+00:00"}, {"state": "WORKLOAD_READY", "timestamp": "2026-10-02T05:43:17.712919+00:00"}, {"state": "ENDPOINT_READY", "timestamp": "2026-10-02T05:43:21.579173+00:00"}], "deployment_mode": "airgap", "bundle_version": "2026-10-02.1", "bundle_verified": true, "network_capabilities": {"dns": null, "https_443": null, "k3s_source": null, "github": null, "cilium_cli_source": null, "cilium_chart": null, "quay": null, "registry_k8s": null, "docker_hub": null, "ghcr": null, "workload_registry": null, "cloudflare_tunnel": null, "wireguard_udp_51820": null}, "network_details": {"external_checks_skipped": true, "reason": "explicit offline mode", "required_unavailable": []}, "network_states": [{"state": "NETWORK_CHECKING", "timestamp": "2026-10-02T05:42:59.021645+00:00"}, {"state": "BUNDLE_VERIFYING", "timestamp": "2026-10-02T05:42:59.021657+00:00"}, {"state": "AIRGAP_PRELOADING", "timestamp": "2026-10-02T05:43:01.589950+00:00"}], "fallback_used": false, "fallback_reason": null, "preload": {"imported_archives": [], "reused_images": ["docker.io/rancher/klipper-helm:v0.13.3-build20260727", "docker.io/rancher/klipper-lb:v0.4.17", "docker.io/rancher/local-path-provisioner:v0.0.37", "docker.io/rancher/mirrored-coredns-coredns:1.14.6", "docker.io/rancher/mirrored-library-busybox:1.37.0", "docker.io/rancher/mirrored-library-traefik:3.7.8", "docker.io/rancher/mirrored-metrics-server:v0.9.0", "docker.io/rancher/mirrored-pause:3.10.2", "quay.io/cilium/cilium@sha256:2939231d0d3e3ebddcd80fffa168b7ddcc78fdf0dc864d1c8c126ff523c54f01", "quay.io/cilium/operator-generic@sha256:64d8798350e8569b8e7622563fed6e44dce2625f311e4651b774816516c744fc", "quay.io/cilium/cilium-envoy@sha256:af7382699576b9e65e9184efa52eeca0b58aea70ad6e511bf260c91d9f740463", "docker.io/curlimages/curl:8.12.1", "docker.io/curlimages/curl@sha256:94e9e444bcba979c2ea12e27ae39bee4cd10bc7041a472c4727a558e213744e6", "docker.io/library/nginx:1.28.0-alpine", "docker.io/library/nginx@sha256:30f1c0d78e0ad60901648be663a710bdadf19e4c10ac6782c235200619158284", "docker.io/library/nginx:1.28.1-alpine", "docker.io/library/nginx@sha256:52e3ada4d978443601f286cc2f9e7b95c82aa3ad5a78ce9c6b94ce00258e68cc"], "digest_verified": true}, "exposure_status": {"requested": "nodeport", "status": "ready", "public_endpoint": null, "reason": null}, "update_available": null}
