{"schema_version": "0.2", "action": "deploy", "provider": "aws", "environment_id": "railshot-airgap-test", "status": "ready", "cluster_status": "ready", "cilium_status": "healthy", "workload_status": "ready", "endpoint": "http://192.168.5.15:30080", "endpoint_scope": "node-local", "error": null, "states": [{"state": "NODE_READY", "timestamp": "2026-10-02T03:19:32.186301+00:00"}, {"state": "K3S_INSTALLING", "timestamp": "2026-10-02T03:19:33.774193+00:00"}, {"state": "K3S_READY", "timestamp": "2026-10-02T03:19:35.411092+00:00"}, {"state": "CILIUM_INSTALLING", "timestamp": "2026-10-02T03:19:35.701543+00:00"}, {"state": "CILIUM_READY", "timestamp": "2026-10-02T03:19:39.492756+00:00"}, {"state": "WORKLOAD_DEPLOYING", "timestamp": "2026-10-02T03:19:39.709572+00:00"}, {"state": "WORKLOAD_READY", "timestamp": "2026-10-02T03:19:40.062381+00:00"}, {"state": "ENDPOINT_READY", "timestamp": "2026-10-02T03:19:42.979891+00:00"}], "deployment_mode": "online", "bundle_version": "2026-10-02.1", "bundle_verified": true, "network_capabilities": {"dns": true, "https_443": true, "k3s_source": true, "github": true, "cilium_cli_source": true, "cilium_chart": true, "quay": true, "registry_k8s": true, "docker_hub": true, "ghcr": true, "workload_registry": null, "cloudflare_tunnel": false, "wireguard_udp_51820": null}, "network_details": {"k3s_source": {"available": true, "url": "https://raw.githubusercontent.com/k3s-io/k3s/v1.34.11%2Bk3s1/install.sh", "protocol": "TLS/TCP", "http_status": 200, "resolved_ip": "185.199.108.133", "curl_exit_code": 0, "error": null, "duration_seconds": 0.076}, "github": {"available": true, "url": "https://github.com/k3s-io/k3s/releases/download/v1.34.11%2Bk3s1/k3s-arm64", "protocol": "TLS/TCP", "http_status": 200, "resolved_ip": "185.199.109.133", "curl_exit_code": 0, "error": null, "duration_seconds": 0.115}, "cilium_cli_source": {"available": true, "url": "https://github.com/cilium/cilium-cli/releases/download/v0.20.1/cilium-linux-arm64.tar.gz", "protocol": "TLS/TCP", "http_status": 200, "resolved_ip": "185.199.109.133", "curl_exit_code": 0, "error": null, "duration_seconds": 0.116}, "cilium_chart": {"available": true, "url": "https://helm.cilium.io/cilium-1.20.2.tgz", "protocol": "TLS/TCP", "http_status": 200, "resolved_ip": "185.199.109.153", "curl_exit_code": 0, "error": null, "duration_seconds": 0.074}, "quay": {"available": true, "url": "https://quay.io/v2/", "protocol": "TLS/TCP", "http_status": 401, "resolved_ip": "98.91.104.20", "curl_exit_code": 0, "error": null, "duration_seconds": 0.63}, "registry_k8s": {"available": true, "url": "https://registry.k8s.io/v2/", "protocol": "TLS/TCP", "http_status": 401, "resolved_ip": "34.96.108.209", "curl_exit_code": 0, "error": null, "duration_seconds": 0.131}, "docker_hub": {"available": true, "url": "https://registry-1.docker.io/v2/", "protocol": "TLS/TCP", "http_status": 401, "resolved_ip": "44.194.203.49", "curl_exit_code": 0, "error": null, "duration_seconds": 0.614}, "ghcr": {"available": true, "url": "https://ghcr.io/v2/", "protocol": "TLS/TCP", "http_status": 401, "resolved_ip": "20.200.245.241", "curl_exit_code": 0, "error": null, "duration_seconds": 0.262}, "cloudflare_tunnel": {"available": false, "url": "https://127.0.0.1:9/", "protocol": "TLS/TCP", "http_status": null, "resolved_ip": null, "curl_exit_code": 7, "error": "curl: (7) Failed to connect to 127.0.0.1 port 9 after 0 ms: Couldn't connect to server", "duration_seconds": 0.008}, "required": ["cilium_chart", "cilium_cli_source", "docker_hub", "github", "k3s_source", "quay"], "required_unavailable": [], "duration_seconds": 0.632, "wireguard_udp_51820": {"available": null, "reason": "Authenticated WireGuard peer/key contract absent; UDP send is not proof"}, "note": "TLS reachability/registry challenge only; image authorization, QUIC and tunnel credentials are not proven"}, "network_states": [{"state": "NETWORK_CHECKING", "timestamp": "2026-10-02T03:19:32.186384+00:00"}, {"state": "BUNDLE_VERIFYING", "timestamp": "2026-10-02T03:19:32.818650+00:00"}, {"state": "AIRGAP_PRELOADING", "timestamp": "2026-10-02T03:19:35.411105+00:00"}], "fallback_used": false, "fallback_reason": null, "preload": {"imported_archives": [], "reused_images": ["docker.io/rancher/klipper-helm:v0.13.3-build20260727", "docker.io/rancher/klipper-lb:v0.4.17", "docker.io/rancher/local-path-provisioner:v0.0.37", "docker.io/rancher/mirrored-coredns-coredns:1.14.6", "docker.io/rancher/mirrored-library-busybox:1.37.0", "docker.io/rancher/mirrored-library-traefik:3.7.8", "docker.io/rancher/mirrored-metrics-server:v0.9.0", "docker.io/rancher/mirrored-pause:3.10.2", "quay.io/cilium/cilium@sha256:2939231d0d3e3ebddcd80fffa168b7ddcc78fdf0dc864d1c8c126ff523c54f01", "quay.io/cilium/operator-generic@sha256:64d8798350e8569b8e7622563fed6e44dce2625f311e4651b774816516c744fc", "quay.io/cilium/cilium-envoy@sha256:af7382699576b9e65e9184efa52eeca0b58aea70ad6e511bf260c91d9f740463", "docker.io/curlimages/curl:8.12.1", "docker.io/curlimages/curl@sha256:94e9e444bcba979c2ea12e27ae39bee4cd10bc7041a472c4727a558e213744e6", "docker.io/library/nginx:1.28.0-alpine", "docker.io/library/nginx@sha256:30f1c0d78e0ad60901648be663a710bdadf19e4c10ac6782c235200619158284", "docker.io/library/nginx:1.28.1-alpine", "docker.io/library/nginx@sha256:52e3ada4d978443601f286cc2f9e7b95c82aa3ad5a78ce9c6b94ce00258e68cc"], "digest_verified": true}, "exposure_status": {"requested": "cloudflare-tunnel", "status": "degraded", "public_endpoint": null, "reason": "connector_not_configured"}, "update_available": null}
