{"schema_version": "0.2", "action": "deploy", "provider": "aws", "environment_id": "railshot-airgap-test", "status": "ready", "cluster_status": "ready", "cilium_status": "healthy", "workload_status": "ready", "endpoint": "http://192.168.5.15:30080", "endpoint_scope": "node-local", "error": null, "states": [{"state": "NODE_READY", "timestamp": "2026-10-02T03:12:57.287662+00:00"}, {"state": "K3S_INSTALLING", "timestamp": "2026-10-02T03:12:58.133295+00:00"}, {"state": "K3S_READY", "timestamp": "2026-10-02T03:13:12.395009+00:00"}, {"state": "CILIUM_INSTALLING", "timestamp": "2026-10-02T03:13:12.395033+00:00"}, {"state": "CILIUM_READY", "timestamp": "2026-10-02T03:14:53.817537+00:00"}, {"state": "WORKLOAD_DEPLOYING", "timestamp": "2026-10-02T03:14:53.871694+00:00"}, {"state": "WORKLOAD_READY", "timestamp": "2026-10-02T03:15:06.098525+00:00"}, {"state": "ENDPOINT_READY", "timestamp": "2026-10-02T03:15:13.222761+00:00"}], "deployment_mode": "online", "bundle_version": null, "bundle_verified": false, "network_capabilities": {"dns": true, "https_443": true, "k3s_source": true, "github": true, "cilium_cli_source": true, "cilium_chart": true, "quay": true, "registry_k8s": true, "docker_hub": true, "ghcr": true, "workload_registry": null, "cloudflare_tunnel": null, "wireguard_udp_51820": null}, "network_details": {"k3s_source": {"available": true, "url": "https://raw.githubusercontent.com/k3s-io/k3s/v1.34.11%2Bk3s1/install.sh", "protocol": "TLS/TCP", "http_status": 200, "resolved_ip": "185.199.108.133", "curl_exit_code": 0, "error": null, "duration_seconds": 0.345}, "github": {"available": true, "url": "https://github.com/k3s-io/k3s/releases/download/v1.34.11%2Bk3s1/k3s-arm64", "protocol": "TLS/TCP", "http_status": 200, "resolved_ip": "185.199.109.133", "curl_exit_code": 0, "error": null, "duration_seconds": 0.669}, "cilium_cli_source": {"available": true, "url": "https://github.com/cilium/cilium-cli/releases/download/v0.20.1/cilium-linux-arm64.tar.gz", "protocol": "TLS/TCP", "http_status": 200, "resolved_ip": "185.199.109.133", "curl_exit_code": 0, "error": null, "duration_seconds": 0.678}, "cilium_chart": {"available": true, "url": "https://helm.cilium.io/cilium-1.20.2.tgz", "protocol": "TLS/TCP", "http_status": 200, "resolved_ip": "185.199.109.153", "curl_exit_code": 0, "error": null, "duration_seconds": 0.745}, "quay": {"available": true, "url": "https://quay.io/v2/", "protocol": "TLS/TCP", "http_status": 401, "resolved_ip": "35.175.54.45", "curl_exit_code": 0, "error": null, "duration_seconds": 0.701}, "registry_k8s": {"available": true, "url": "https://registry.k8s.io/v2/", "protocol": "TLS/TCP", "http_status": 401, "resolved_ip": "34.96.108.209", "curl_exit_code": 0, "error": null, "duration_seconds": 0.354}, "docker_hub": {"available": true, "url": "https://registry-1.docker.io/v2/", "protocol": "TLS/TCP", "http_status": 401, "resolved_ip": "100.48.25.216", "curl_exit_code": 0, "error": null, "duration_seconds": 0.836}, "ghcr": {"available": true, "url": "https://ghcr.io/v2/", "protocol": "TLS/TCP", "http_status": 401, "resolved_ip": "20.200.245.241", "curl_exit_code": 0, "error": null, "duration_seconds": 0.348}, "required": ["cilium_chart", "cilium_cli_source", "docker_hub", "github", "k3s_source", "quay"], "required_unavailable": [], "duration_seconds": 0.845, "wireguard_udp_51820": {"available": null, "reason": "Authenticated WireGuard peer/key contract absent; UDP send is not proof"}, "note": "TLS reachability/registry challenge only; image authorization, QUIC and tunnel credentials are not proven"}, "network_states": [{"state": "NETWORK_CHECKING", "timestamp": "2026-10-02T03:12:57.287734+00:00"}], "fallback_used": false, "fallback_reason": null, "preload": {}, "exposure_status": {"requested": "nodeport", "status": "ready", "public_endpoint": null, "reason": null}, "update_available": null}
