{"schema_version": "0.2", "action": "cleanup", "provider": "aws", "environment_id": "railshot-airgap-test", "status": "cleaned", "cluster_status": "api_ready", "cilium_status": "unknown", "workload_status": "absent", "endpoint": null, "endpoint_scope": null, "error": null, "states": [{"state": "NODE_READY", "timestamp": "2026-10-02T06:04:27.986547+00:00"}, {"state": "K3S_READY", "timestamp": "2026-10-02T06:04:28.061346+00:00"}], "deployment_mode": null, "bundle_version": null, "bundle_verified": false, "network_capabilities": {}, "network_details": {}, "network_states": [], "fallback_used": false, "fallback_reason": null, "preload": {}, "exposure_status": {}, "update_available": null}
