{"schema_version": "0.2", "action": "deploy", "provider": "aws", "environment_id": "railshot-airgap-test", "status": "failed", "cluster_status": "unknown", "cilium_status": "unknown", "workload_status": "unknown", "endpoint": null, "endpoint_scope": null, "error": {"code": "BUNDLE_REQUIRED", "stage": "NETWORK_CHECKING", "message": "Offline/fallback needs a valid local bundle; unreachable: docker_hub, quay", "exit_code": null, "diagnostics": null}, "states": [{"state": "NODE_READY", "timestamp": "2026-10-02T03:16:09.689208+00:00"}, {"state": "FAILED", "timestamp": "2026-10-02T03:16:10.023412+00:00"}], "deployment_mode": null, "bundle_version": null, "bundle_verified": false, "network_capabilities": {"dns": true, "https_443": true, "k3s_source": true, "github": true, "cilium_cli_source": true, "cilium_chart": true, "quay": false, "registry_k8s": true, "docker_hub": false, "ghcr": true, "workload_registry": null, "cloudflare_tunnel": null, "wireguard_udp_51820": null}, "network_details": {"k3s_source": {"available": true, "url": "https://raw.githubusercontent.com/k3s-io/k3s/v1.34.11%2Bk3s1/install.sh", "protocol": "TLS/TCP", "http_status": 200, "resolved_ip": "185.199.108.133", "curl_exit_code": 0, "error": null, "duration_seconds": 0.136}, "github": {"available": true, "url": "https://github.com/k3s-io/k3s/releases/download/v1.34.11%2Bk3s1/k3s-arm64", "protocol": "TLS/TCP", "http_status": 200, "resolved_ip": "185.199.109.133", "curl_exit_code": 0, "error": null, "duration_seconds": 0.174}, "cilium_cli_source": {"available": true, "url": "https://github.com/cilium/cilium-cli/releases/download/v0.20.1/cilium-linux-arm64.tar.gz", "protocol": "TLS/TCP", "http_status": 200, "resolved_ip": "185.199.109.133", "curl_exit_code": 0, "error": null, "duration_seconds": 0.175}, "cilium_chart": {"available": true, "url": "https://helm.cilium.io/cilium-1.20.2.tgz", "protocol": "TLS/TCP", "http_status": 200, "resolved_ip": "185.199.109.153", "curl_exit_code": 0, "error": null, "duration_seconds": 0.136}, "quay": {"available": false, "url": "https://127.0.0.1:9/v2/", "protocol": "TLS/TCP", "http_status": null, "resolved_ip": null, "curl_exit_code": 7, "error": "curl: (7) Failed to connect to 127.0.0.1 port 9 after 0 ms: Couldn't connect to server", "duration_seconds": 0.018}, "registry_k8s": {"available": true, "url": "https://registry.k8s.io/v2/", "protocol": "TLS/TCP", "http_status": 401, "resolved_ip": "34.96.108.209", "curl_exit_code": 0, "error": null, "duration_seconds": 0.28}, "docker_hub": {"available": false, "url": "https://127.0.0.1:9/v2/", "protocol": "TLS/TCP", "http_status": null, "resolved_ip": null, "curl_exit_code": 7, "error": "curl: (7) Failed to connect to 127.0.0.1 port 9 after 0 ms: Couldn't connect to server", "duration_seconds": 0.014}, "ghcr": {"available": true, "url": "https://ghcr.io/v2/", "protocol": "TLS/TCP", "http_status": 401, "resolved_ip": "20.200.245.241", "curl_exit_code": 0, "error": null, "duration_seconds": 0.324}, "required": ["cilium_chart", "cilium_cli_source", "docker_hub", "github", "k3s_source", "quay"], "required_unavailable": ["docker_hub", "quay"], "duration_seconds": 0.334, "wireguard_udp_51820": {"available": null, "reason": "Authenticated WireGuard peer/key contract absent; UDP send is not proof"}, "note": "TLS reachability/registry challenge only; image authorization, QUIC and tunnel credentials are not proven"}, "network_states": [{"state": "NETWORK_CHECKING", "timestamp": "2026-10-02T03:16:09.689284+00:00"}], "fallback_used": false, "fallback_reason": null, "preload": {}, "exposure_status": {}, "update_available": null}
