{"schema_version": "0.2", "action": "deploy", "provider": "aws", "environment_id": "railshot-airgap-test", "status": "failed", "cluster_status": "unknown", "cilium_status": "unknown", "workload_status": "unknown", "endpoint": null, "endpoint_scope": null, "error": {"code": "BUNDLE_PLATFORM_MISMATCH", "stage": "BUNDLE_VERIFYING", "message": "Bundle=linux/amd64, node=linux/arm64", "exit_code": null, "diagnostics": null}, "states": [{"state": "NODE_READY", "timestamp": "2026-10-02T06:06:10.400376+00:00"}, {"state": "FAILED", "timestamp": "2026-10-02T06:06:10.400865+00:00"}], "deployment_mode": null, "bundle_version": null, "bundle_verified": false, "network_capabilities": {"dns": null, "https_443": null, "k3s_source": null, "github": null, "cilium_cli_source": null, "cilium_chart": null, "quay": null, "registry_k8s": null, "docker_hub": null, "ghcr": null, "workload_registry": null, "cloudflare_tunnel": null, "wireguard_udp_51820": null}, "network_details": {"external_checks_skipped": true, "reason": "explicit offline mode", "required_unavailable": []}, "network_states": [{"state": "NETWORK_CHECKING", "timestamp": "2026-10-02T06:06:10.400438+00:00"}, {"state": "BUNDLE_VERIFYING", "timestamp": "2026-10-02T06:06:10.400450+00:00"}], "fallback_used": false, "fallback_reason": null, "preload": {}, "exposure_status": {}, "update_available": null}
