{"schema_version": "0.2", "action": "deploy", "provider": "aws", "environment_id": "railshot-airgap-test", "status": "failed", "cluster_status": "unknown", "cilium_status": "unknown", "workload_status": "unknown", "endpoint": null, "endpoint_scope": null, "error": {"code": "BUNDLE_REQUIRED", "stage": "NETWORK_CHECKING", "message": "Offline/fallback needs a valid local bundle; unreachable: cilium_chart, cilium_cli_source, docker_hub, github, k3s_source, quay, registry_k8s", "exit_code": null, "diagnostics": null}, "states": [{"state": "NODE_READY", "timestamp": "2026-10-02T06:06:07.822284+00:00"}, {"state": "FAILED", "timestamp": "2026-10-02T06:06:09.845884+00:00"}], "deployment_mode": null, "bundle_version": null, "bundle_verified": false, "network_capabilities": {"dns": true, "https_443": false, "k3s_source": false, "github": false, "cilium_cli_source": false, "cilium_chart": false, "quay": false, "registry_k8s": false, "docker_hub": false, "ghcr": false, "workload_registry": null, "cloudflare_tunnel": null, "wireguard_udp_51820": null}, "network_details": {"k3s_source": {"available": false, "url": "https://127.0.0.1:47569/", "protocol": "TLS/TCP", "http_status": null, "resolved_ip": "127.0.0.1", "curl_exit_code": 28, "error": "curl: (28) Connection timed out after 2002 milliseconds", "duration_seconds": 2.013}, "github": {"available": false, "url": "https://127.0.0.1:47569/", "protocol": "TLS/TCP", "http_status": null, "resolved_ip": "127.0.0.1", "curl_exit_code": 28, "error": "curl: (28) Connection timed out after 2002 milliseconds", "duration_seconds": 2.011}, "cilium_cli_source": {"available": false, "url": "https://127.0.0.1:47569/", "protocol": "TLS/TCP", "http_status": null, "resolved_ip": "127.0.0.1", "curl_exit_code": 28, "error": "curl: (28) Connection timed out after 2002 milliseconds", "duration_seconds": 2.011}, "cilium_chart": {"available": false, "url": "https://127.0.0.1:47569/", "protocol": "TLS/TCP", "http_status": null, "resolved_ip": "127.0.0.1", "curl_exit_code": 28, "error": "curl: (28) Connection timed out after 2001 milliseconds", "duration_seconds": 2.016}, "quay": {"available": false, "url": "https://127.0.0.1:47569/", "protocol": "TLS/TCP", "http_status": null, "resolved_ip": "127.0.0.1", "curl_exit_code": 28, "error": "curl: (28) Connection timed out after 2002 milliseconds", "duration_seconds": 2.02}, "registry_k8s": {"available": false, "url": "https://127.0.0.1:47569/", "protocol": "TLS/TCP", "http_status": null, "resolved_ip": "127.0.0.1", "curl_exit_code": 28, "error": "curl: (28) Connection timed out after 2002 milliseconds", "duration_seconds": 2.015}, "docker_hub": {"available": false, "url": "https://127.0.0.1:47569/", "protocol": "TLS/TCP", "http_status": null, "resolved_ip": "127.0.0.1", "curl_exit_code": 28, "error": "curl: (28) Connection timed out after 2001 milliseconds", "duration_seconds": 2.017}, "ghcr": {"available": false, "url": "https://127.0.0.1:47569/", "protocol": "TLS/TCP", "http_status": null, "resolved_ip": "127.0.0.1", "curl_exit_code": 28, "error": "curl: (28) Connection timed out after 2003 milliseconds", "duration_seconds": 2.013}, "required": ["cilium_chart", "cilium_cli_source", "docker_hub", "github", "k3s_source", "quay", "registry_k8s"], "required_unavailable": ["cilium_chart", "cilium_cli_source", "docker_hub", "github", "k3s_source", "quay", "registry_k8s"], "duration_seconds": 2.023, "wireguard_udp_51820": {"available": null, "reason": "Authenticated WireGuard peer/key contract absent; UDP send is not proof"}, "note": "TLS reachability/registry challenge only; image authorization, QUIC and tunnel credentials are not proven"}, "network_states": [{"state": "NETWORK_CHECKING", "timestamp": "2026-10-02T06:06:07.822339+00:00"}], "fallback_used": false, "fallback_reason": null, "preload": {}, "exposure_status": {}, "update_available": null}
