{"schema_version": "0.2", "action": "deploy", "provider": "aws", "environment_id": "railshot-airgap-test", "status": "failed", "cluster_status": "api_ready", "cilium_status": "failed", "workload_status": "unknown", "endpoint": null, "endpoint_scope": null, "error": {"code": "COMMAND_FAILED", "stage": "CILIUM_INSTALLING", "message": "-250-10-11                    Node ip-10-250-10-11 event: Registered Node ip-10-250-10-11 in Controller\nkube-system   3m3s        Normal    AppliedManifest                  addon/coredns                           Applied manifest at \"/var/lib/rancher/k3s/server/manifests/coredns.yaml\"\nkube-system   3m2s        Normal    AppliedManifest                  addon/runtimes                          Applied manifest at \"/var/lib/rancher/k3s/server/manifests/runtimes.yaml\"\nkube-system   3m2s        Normal    ApplyingManifest                 addon/runtimes                          Applying manifest at \"/var/lib/rancher/k3s/server/manifests/runtimes.yaml\"\nkube-system   3m2s        Normal    ScalingReplicaSet                deployment/coredns                      Scaled up replica set coredns-fddcf74bb from 0 to 1\nkube-system   3m2s        Normal    AppliedManifest                  addon/rolebindings                      Applied manifest at \"/var/lib/rancher/k3s/server/manifests/rolebindings.yaml\"\nkube-system   3m2s        Normal    SuccessfulCreate                 replicaset/coredns-fddcf74bb            Created pod: coredns-fddcf74bb-hn5dt\nkube-system   3m2s        Normal    ApplyingManifest                 addon/rolebindings                      Applying manifest at \"/var/lib/rancher/k3s/server/manifests/rolebindings.yaml\"\nkube-system   3m2s        Normal    DeletingManifest                 addon/local-storage                     Deleting manifest at \"/var/lib/rancher/k3s/server/manifests/local-storage.yaml\"\nkube-system   3m1s        Normal    SuccessfulCreate                 daemonset/cilium                        Created pod: cilium-l5pv6\nkube-system   3m1s        Normal    SuccessfulCreate                 daemonset/cilium-envoy                  Created pod: cilium-envoy-zh4fp\nkube-system   3m1s        Normal    ScalingReplicaSet                deployment/cilium-operator              Scaled up replica set cilium-operator-5ccfb4f5c8 from 0 to 1\nkube-system   3m1s        Normal    SuccessfulCreate                 replicaset/cilium-operator-5ccfb4f5c8   Created pod: cilium-operator-5ccfb4f5c8-mn2gr\nkube-system   3m1s        Normal    DeletingManifest                 addon/traefik                           Deleting manifest at \"/var/lib/rancher/k3s/server/manifests/traefik.yaml\"\nkube-system   2m57s       Normal    Pulling                          pod/cilium-operator-5ccfb4f5c8-mn2gr    Pulling image \"quay.io/cilium/operator-generic@sha256:64d8798350e8569b8e7622563fed6e44dce2625f311e4651b774816516c744fc\"\nkube-system   2m57s       Normal    Pulling                          pod/cilium-envoy-zh4fp                  Pulling image \"quay.io/cilium/cilium-envoy@sha256:af7382699576b9e65e9184efa52eeca0b58aea70ad6e511bf260c91d9f740463\"\nkube-system   2m57s       Normal    Pulling                          pod/cilium-l5pv6                        Pulling image \"quay.io/cilium/cilium@sha256:2939231d0d3e3ebddcd80fffa168b7ddcc78fdf0dc864d1c8c126ff523c54f01\"\nkube-system   109s        Warning   FailedCreatePodSandBox           pod/coredns-fddcf74bb-hn5dt             Failed to create pod sandbox: rpc error: code = Unknown desc = failed to setup network for sandbox \"08da641a87ee014a7dc5b404b532c214399bd67c52d6445e6784bcfc32c75238\": plugin type=\"cilium-cni\" failed (add): unable to connect to Cilium agent: failed to create cilium agent client after 30.000000 seconds timeout: Get \"http://localhost/v1/config\": dial unix /var/run/cilium/cilium.sock: connect: no such file or directory...\nkube-system   99s         Normal    Started                          pod/cilium-envoy-zh4fp                  Started container cilium-envoy\nkube-system   99s         Normal    Created                          pod/cilium-envoy-zh4fp                  Created container: cilium-envoy\nkube-system   99s         Normal    Pulled                           pod/cilium-envoy-zh4fp                  Successfully pulled image \"quay.io/cilium/cilium-envoy@sha256:af7382699576b9e65e9184efa52eeca0b58aea70ad6e511bf260c91d9f740463\" in 1m17.559s (1m17.559s including waiting). Image size: 73789298 bytes.\nkube-system   45s         Warning   Unhealthy                        pod/cilium-envoy-zh4fp                  Startup probe failed: Get \"http://127.0.0.1:9878/healthz\": dial tcp 127.0.0.1:9878: connect: connection refused\nkube-system   24s         Warning   FailedCreatePodSandBox           pod/coredns-fddcf74bb-hn5dt             Failed to create pod sandbox: rpc error: code = Unknown desc = failed to setup network for sandbox \"1e952b37eaafe6c76921ca4df55c1f87c630c5339a2e7a9a8e7ed7d415d506b6\": plugin type=\"cilium-cni\" failed (add): unable to connect to Cilium agent: failed to create cilium agent client after 30.000000 seconds timeout: Get \"http://localhost/v1/config\": dial unix /var/run/cilium/cilium.sock: connect: no such file or directory...\n[2026-10-02T05:54:02Z] [install] 진단: journalctl -u k3s -n 100; k3s kubectl get pods -A -o wide; k3s kubectl get events -A --sort-by=.lastTimestamp", "exit_code": 1, "diagnostics": null}, "states": [{"state": "NODE_READY", "timestamp": "2026-10-02T05:50:45.450020+00:00"}, {"state": "K3S_INSTALLING", "timestamp": "2026-10-02T05:50:46.354786+00:00"}, {"state": "K3S_READY", "timestamp": "2026-10-02T05:50:55.416854+00:00"}, {"state": "CILIUM_INSTALLING", "timestamp": "2026-10-02T05:50:55.416914+00:00"}, {"state": "FAILED", "timestamp": "2026-10-02T05:54:02.215009+00:00"}], "deployment_mode": "online", "bundle_version": null, "bundle_verified": false, "network_capabilities": {"dns": true, "https_443": true, "k3s_source": true, "github": true, "cilium_cli_source": true, "cilium_chart": true, "quay": true, "registry_k8s": true, "docker_hub": true, "ghcr": true, "workload_registry": null, "cloudflare_tunnel": null, "wireguard_udp_51820": null}, "network_details": {"k3s_source": {"available": true, "url": "https://raw.githubusercontent.com/k3s-io/k3s/v1.34.11%2Bk3s1/install.sh", "protocol": "TLS/TCP", "http_status": 200, "resolved_ip": "185.199.108.133", "curl_exit_code": 0, "error": null, "duration_seconds": 0.395}, "github": {"available": true, "url": "https://github.com/k3s-io/k3s/releases/download/v1.34.11%2Bk3s1/k3s-arm64", "protocol": "TLS/TCP", "http_status": 200, "resolved_ip": "185.199.109.133", "curl_exit_code": 0, "error": null, "duration_seconds": 0.7}, "cilium_cli_source": {"available": true, "url": "https://github.com/cilium/cilium-cli/releases/download/v0.20.1/cilium-linux-arm64.tar.gz", "protocol": "TLS/TCP", "http_status": 200, "resolved_ip": "185.199.109.133", "curl_exit_code": 0, "error": null, "duration_seconds": 0.704}, "cilium_chart": {"available": true, "url": "https://helm.cilium.io/cilium-1.20.2.tgz", "protocol": "TLS/TCP", "http_status": 200, "resolved_ip": "185.199.111.153", "curl_exit_code": 0, "error": null, "duration_seconds": 0.415}, "quay": {"available": true, "url": "https://quay.io/v2/", "protocol": "TLS/TCP", "http_status": 401, "resolved_ip": "98.95.179.34", "curl_exit_code": 0, "error": null, "duration_seconds": 0.897}, "registry_k8s": {"available": true, "url": "https://registry.k8s.io/v2/", "protocol": "TLS/TCP", "http_status": 401, "resolved_ip": "34.96.108.209", "curl_exit_code": 0, "error": null, "duration_seconds": 0.362}, "docker_hub": {"available": true, "url": "https://registry-1.docker.io/v2/", "protocol": "TLS/TCP", "http_status": 401, "resolved_ip": "100.63.226.34", "curl_exit_code": 0, "error": null, "duration_seconds": 0.898}, "ghcr": {"available": true, "url": "https://ghcr.io/v2/", "protocol": "TLS/TCP", "http_status": 401, "resolved_ip": "20.200.245.241", "curl_exit_code": 0, "error": null, "duration_seconds": 0.405}, "required": ["cilium_chart", "cilium_cli_source", "docker_hub", "github", "k3s_source", "quay", "registry_k8s"], "required_unavailable": [], "duration_seconds": 0.904, "wireguard_udp_51820": {"available": null, "reason": "Authenticated WireGuard peer/key contract absent; UDP send is not proof"}, "note": "TLS reachability/registry challenge only; image authorization, QUIC and tunnel credentials are not proven"}, "network_states": [{"state": "NETWORK_CHECKING", "timestamp": "2026-10-02T05:50:45.450181+00:00"}], "fallback_used": false, "fallback_reason": null, "preload": {}, "exposure_status": {}, "update_available": null}
