{"schema_version": "0.2", "action": "verify", "provider": "aws", "environment_id": "railshot-runtime-demo", "status": "ready", "cluster_status": "ready", "cilium_status": "healthy", "workload_status": "ready", "endpoint": "http://192.168.5.15:30080", "endpoint_scope": "node-local", "error": null, "states": [{"state": "NODE_READY", "timestamp": "2026-10-02T06:08:58.936305+00:00"}, {"state": "K3S_READY", "timestamp": "2026-10-02T06:08:59.993007+00:00"}, {"state": "CILIUM_READY", "timestamp": "2026-10-02T06:09:00.499327+00:00"}, {"state": "WORKLOAD_READY", "timestamp": "2026-10-02T06:09:00.873354+00:00"}, {"state": "ENDPOINT_READY", "timestamp": "2026-10-02T06:09:04.212093+00:00"}], "deployment_mode": "airgap", "bundle_version": "2026-10-02.1", "bundle_verified": true, "network_capabilities": {}, "network_details": {}, "network_states": [], "fallback_used": false, "fallback_reason": null, "preload": {}, "exposure_status": {"requested": "nodeport", "status": "ready", "public_endpoint": null, "reason": null}, "update_available": null}
